{
  "bundleVersion": "1.0.0",
  "schemaVersion": 1,
  "routines": [
    {
      "id": "stress_reset_1",
      "title": "Stress Reset Gentle Flow",
      "totalDurationSeconds": 600,
      "catalogTags": [
        "stress_relief",
        "full_body_gentle",
        "restorative_flow"
      ],
      "enrichmentRefs": [
        "breath_box_4_4",
        "mindful_notice",
        "quote_desikachar"
      ],
      "steps": [
        {
          "poseId": "easy_seated",
          "durationSeconds": 60,
          "cues": [
            "Sit tall and settle your breath."
          ]
        },
        {
          "poseId": "cat",
          "durationSeconds": 60,
          "cues": [
            "Round the spine slowly on each exhale."
          ]
        },
        {
          "poseId": "cow",
          "durationSeconds": 60,
          "cues": [
            "Open the chest gently on each inhale."
          ]
        },
        {
          "poseId": "balancing_table",
          "durationSeconds": 60,
          "cues": [
            "Reach opposite arm and leg with control."
          ]
        },
        {
          "poseId": "childs_pose",
          "durationSeconds": 60,
          "cues": [
            "Rest and soften your jaw."
          ]
        },
        {
          "poseId": "downward_facing_dog",
          "durationSeconds": 60,
          "cues": [
            "Lengthen your spine with easy knees."
          ]
        },
        {
          "poseId": "standing_forward_fold",
          "durationSeconds": 60,
          "cues": [
            "Release the neck and shoulders."
          ]
        },
        {
          "poseId": "bound_angle",
          "durationSeconds": 60,
          "cues": [
            "Stay upright and breathe into the hips."
          ]
        },
        {
          "poseId": "supine_twist",
          "durationSeconds": 60,
          "cues": [
            "Rotate softly and keep both shoulders grounded."
          ]
        },
        {
          "poseId": "happy_baby",
          "durationSeconds": 60,
          "cues": [
            "Relax your lower back and breathe slowly."
          ]
        }
      ]
    },
    {
      "id": "neck_release_1",
      "title": "Neck and Shoulder Ease",
      "totalDurationSeconds": 600,
      "catalogTags": [
        "neck_shoulders",
        "upper_back",
        "restorative_flow"
      ],
      "enrichmentRefs": [
        "breath_long_exhale",
        "quote_bks_iyengar"
      ],
      "steps": [
        {
          "poseId": "easy_seated",
          "durationSeconds": 60,
          "cues": [
            "Sit calmly and drop your shoulders."
          ]
        },
        {
          "poseId": "cat",
          "durationSeconds": 60,
          "cues": [
            "Move slowly through spinal flexion."
          ]
        },
        {
          "poseId": "cow",
          "durationSeconds": 60,
          "cues": [
            "Lift the chest without forcing range."
          ]
        },
        {
          "poseId": "balancing_table",
          "durationSeconds": 60,
          "cues": [
            "Hold steady and keep neck long."
          ]
        },
        {
          "poseId": "dolphin",
          "durationSeconds": 60,
          "cues": [
            "Press forearms down and widen upper back."
          ]
        },
        {
          "poseId": "childs_pose",
          "durationSeconds": 60,
          "cues": [
            "Rest your forehead and breathe slowly."
          ]
        },
        {
          "poseId": "seated_spinal_twist",
          "durationSeconds": 60,
          "cues": [
            "Twist from your ribs, not neck strain."
          ]
        },
        {
          "poseId": "bound_angle",
          "durationSeconds": 60,
          "cues": [
            "Open through collarbones while seated tall."
          ]
        },
        {
          "poseId": "supine_twist",
          "durationSeconds": 60,
          "cues": [
            "Relax shoulders evenly into mat."
          ]
        },
        {
          "poseId": "happy_baby",
          "durationSeconds": 60,
          "cues": [
            "Finish with soft, even breaths."
          ]
        }
      ]
    },
    {
      "id": "neck_release_2",
      "title": "Upper Body Unwind",
      "totalDurationSeconds": 600,
      "catalogTags": [
        "neck_shoulders",
        "stress_relief",
        "upper_back"
      ],
      "enrichmentRefs": [
        "mindful_notice",
        "quote_desikachar"
      ],
      "steps": [
        {
          "poseId": "easy_seated",
          "durationSeconds": 60,
          "cues": [
            "Begin in an upright comfortable seat."
          ]
        },
        {
          "poseId": "cat",
          "durationSeconds": 60,
          "cues": [
            "Exhale to round and release the back body."
          ]
        },
        {
          "poseId": "cow",
          "durationSeconds": 60,
          "cues": [
            "Inhale to gently broaden your chest."
          ]
        },
        {
          "poseId": "childs_pose",
          "durationSeconds": 60,
          "cues": [
            "Pause and soften your neck."
          ]
        },
        {
          "poseId": "downward_facing_dog",
          "durationSeconds": 60,
          "cues": [
            "Pedal feet and keep shoulders spacious."
          ]
        },
        {
          "poseId": "high_lunge",
          "durationSeconds": 60,
          "cues": [
            "Lift through the spine and relax jaw."
          ]
        },
        {
          "poseId": "standing_forward_fold",
          "durationSeconds": 60,
          "cues": [
            "Let the crown of head feel heavy."
          ]
        },
        {
          "poseId": "seated_spinal_twist",
          "durationSeconds": 60,
          "cues": [
            "Keep neck neutral while rotating."
          ]
        },
        {
          "poseId": "supine_twist",
          "durationSeconds": 60,
          "cues": [
            "Ease each side with slow breathing."
          ]
        },
        {
          "poseId": "happy_baby",
          "durationSeconds": 60,
          "cues": [
            "Close with a quiet and steady exhale."
          ]
        }
      ]
    },
    {
      "id": "hip_opening_1",
      "title": "Gentle Hip Opening",
      "totalDurationSeconds": 600,
      "catalogTags": [
        "hip_opening",
        "lower_body_mobility",
        "full_body_gentle"
      ],
      "enrichmentRefs": [
        "breath_box_4_4",
        "sanskrit_tadasana"
      ],
      "steps": [
        {
          "poseId": "easy_seated",
          "durationSeconds": 60,
          "cues": [
            "Settle and lengthen the spine."
          ]
        },
        {
          "poseId": "bound_angle",
          "durationSeconds": 60,
          "cues": [
            "Tip pelvis slightly forward to open hips."
          ]
        },
        {
          "poseId": "lizard",
          "durationSeconds": 60,
          "cues": [
            "Lower hands and breathe into front hip."
          ]
        },
        {
          "poseId": "pigeon",
          "durationSeconds": 60,
          "cues": [
            "Stay lifted and avoid knee strain."
          ]
        },
        {
          "poseId": "high_lunge",
          "durationSeconds": 60,
          "cues": [
            "Press through back heel strongly."
          ]
        },
        {
          "poseId": "warrior_2",
          "durationSeconds": 60,
          "cues": [
            "Track front knee over middle toes."
          ]
        },
        {
          "poseId": "triangle",
          "durationSeconds": 60,
          "cues": [
            "Lengthen both sides of the torso."
          ]
        },
        {
          "poseId": "standing_forward_fold",
          "durationSeconds": 60,
          "cues": [
            "Release back of legs with soft knees."
          ]
        },
        {
          "poseId": "supine_twist",
          "durationSeconds": 60,
          "cues": [
            "Gentle twist to neutralize hips."
          ]
        },
        {
          "poseId": "happy_baby",
          "durationSeconds": 60,
          "cues": [
            "Breathe wide into the lower back."
          ]
        }
      ]
    },
    {
      "id": "hip_opening_2",
      "title": "Hips and Legs Mobility",
      "totalDurationSeconds": 600,
      "catalogTags": [
        "hip_opening",
        "lower_body_mobility"
      ],
      "enrichmentRefs": [
        "mindful_notice",
        "quote_bks_iyengar"
      ],
      "steps": [
        {
          "poseId": "easy_seated",
          "durationSeconds": 60,
          "cues": [
            "Take a grounding breath before movement."
          ]
        },
        {
          "poseId": "bound_angle",
          "durationSeconds": 60,
          "cues": [
            "Sit tall and broaden through chest."
          ]
        },
        {
          "poseId": "high_lunge",
          "durationSeconds": 60,
          "cues": [
            "Sink hips while keeping front knee stable."
          ]
        },
        {
          "poseId": "warrior_1",
          "durationSeconds": 60,
          "cues": [
            "Lift arms and keep shoulders soft."
          ]
        },
        {
          "poseId": "reverse_warrior",
          "durationSeconds": 60,
          "cues": [
            "Lengthen side body with easy breath."
          ]
        },
        {
          "poseId": "triangle",
          "durationSeconds": 60,
          "cues": [
            "Stack shoulders as you hinge from hips."
          ]
        },
        {
          "poseId": "lizard",
          "durationSeconds": 60,
          "cues": [
            "Stay low and steady in front hip."
          ]
        },
        {
          "poseId": "pigeon",
          "durationSeconds": 60,
          "cues": [
            "Use support if needed under hip."
          ]
        },